text,claim
"∆

In short, I don't need to feel guilty when I'm attracted to people I know I can't have?
Maybe I'm too black-and-white to think that the murmurs of my id are natural and not evil.

As for which relationship is *higher* from a quantifiable standpoint, I see what you mean.
When I said highest, I meant it not from a perspective of quantity of some sort, but of a level of worth.
Looking at that statement, however, I think you're right again--who is to put a romantic relationship above a friendship?

It's a bit extreme and morbid, but if I were to put someone's spouse and someone's absolute best friend in front of a train and gave that person one to save, whom would they save?
Maybe I just find that once I reach a certain threshold with a guy-friend, I find that we become best friends, but when I reach that threshold with a girl-friend, I find that I want more.
Maybe I haven't been around the block enough or had enough female friends to feel this way.
I don't have any lesbian friends (as far as I know at least), so I don't know how I would react to being great friends with one.","I'm too black-and-white to think that the murmurs of my id are natural and not evil
I see what you mean
I think you're right
I don't know how I would react to being great friends with one."
"Society might collapse, lots of people may starve/die in struggle for survival, but extinction of a whole species seems highly unlikely.
We're not dependent on our technology to survive.
There's lots of open country and unspoiled/airable farmland.
Lots of people today live subsistence off the grid throughout the world.
I don;t think it would devolve into a pure hunter gatherer society (maybe a bit at first) but once the dust settles it would probably stabilize at a preindustrial agricultural society.
People are smart, printed books still exist, where the average group of city slickers could get enough knowledge to plant some crops and survive off the land.","Society might collapse, lots of people may starve/die in struggle for survival, but extinction of a whole species seems highly unlikely.
I don;t think it would devolve into a pure hunter gatherer society (maybe a bit at first)
once the dust settles it would probably stabilize at a preindustrial agricultural society"
"So recently I've seen a lot of posts condemning Islam as a violent religion or a sexist religion.
I point out that many Christians follow the bible which has numerous examples of sexism, but in application, there are numerous branches of Christianity that are no more sexist than secular groups.
For example, Congregationalists and Universaliists.

So, my belief is that while religion can inform the views of people, it is far more likely that religion will be used to justify actions that would have been executed any way. I think that most Jewish people don't want to stone adulterers and most Muslims don't want to stone non believers.","I point out that many Christians follow the bible which has numerous examples of sexism, but in application, there are numerous branches of Christianity that are no more sexist than secular groups.
my belief is that while religion can inform the views of people, it is far more likely that religion will be used to justify actions that would have been executed any way.
I think that most Jewish people don't want to stone adulterers and most Muslims don't want to stone non believers."
"Meat is the industry that creates the most suffering for animals though... Being the one that requires the most land usage and causes the most environmental issues as well as obviously slaughtering them.

Vegans are also the group least likely to die of heart disease, with vegetarians being second and omnivores being first (or the same, depending on which study you're looking at).
I'm convinced it's a healthier diet, which is a nice bonus for being compassionate.","Meat is the industry that creates the most suffering for animals
I'm convinced it's a healthier diet, which is a nice bonus for being compassionate."
"Christianity was primarily spread by the Roman empire.
But Rome already had a state religion before it adopted Christianity.
So the victory of Christianity over the Roman version of Hellenism can't be attributed to geography alone.

Likewise, Islam was hardly the first religion that Arabia had seen.
Its dominance there was not mere geography.","So the victory of Christianity over the Roman version of Hellenism can't be attributed to geography alone
Its dominance there was not mere geography"
"I think it's fairly normal to be a speciesist.
I want to make note that I'm not trying to argue from a point of naturalism in regards to what ought to be done, but that it shouldn't be that surprising when we encounter people that are that way.

I mean hell, it's hard enough for many people to empathize with *each other*, and you're asking them to try to put themselves in the hooves of a cow?
It's just beyond the scope for many people unless they seriously put the time in to think about it, and they've got their own lives to worry about.

To address your last question, yes, the bible states that all animals were put on earth by God to serve man.
There were rules against eating certain kinds, but overall the idea was that humans have dominion over all.
In which case, there is no cognitive dissonance, but this would probably fall under your 2nd line of reasoning.","I think it's fairly normal to be a speciesist.
I'm not trying to argue from a point of naturalism in regards to what ought to be done
it shouldn't be that surprising when we encounter people that are that way
it's hard enough for many people to empathize with *each other*
It's just beyond the scope for many people
the bible states that all animals were put on earth by God to serve man
There were rules against eating certain kinds
overall the idea was that humans have dominion over all
there is no cognitive dissonance
this would probably fall under your 2nd line of reasoning"
"I don't think this depends as much on the cheater as the person he/she cheated on.
Some people are unable to stay with an unfaithful partner and should not be pressured into continuing a relationship after that point.
Forgiveness depends on the forgiver, not the perpetrator.

Nobody ""should"" be forgiven for cheating, and I'm comfortable saying that anyone who knowingly betrays the trust of a relationship would deserve losing that relationship.
I wouldn't go so far as to say that it's expected to break up with the cheater, because some people are willing to be forgiving.
But I can't envision a situation where cheating ""should"" be forgiven.
Forgiveness is a gift, not an expectation.","I don't think this depends as much on the cheater as the person he/she cheated on.
Nobody ""should"" be forgiven for cheating
I'm comfortable saying that anyone who knowingly betrays the trust of a relationship would deserve losing that relationship.
I wouldn't go so far as to say that it's expected to break up with the cheater"
"many laws regulate things that are simply far too complex to simplify to that level.
It generally takes an undergraduate college level education at minimum to understand something like international financial markets and to then effectively regulate them.
Laws have to be made with a working knowledge of the system and their language will reflect that.",many laws regulate things that are simply far too complex to simplify to that level
"Title is mostly to get attention, and I'm working from a specific set of assumptions.
My argument is as follows:

1) The chances of the entire world adopting a vegan/vegetarian diet are slim to none

1a) Therefore, there will always be a market for meat and other animal products

2) The food market, like all other markets, operates on general principles of supply and demand

3) Meat farmers can use techniques exhibiting a range of costs or benefits, both in terms of environmental impact and animal welfare.

4) A vegan or vegetarian diet denies demand, and thus potential revenue, to all meat-producing farms, regardless of how humane or environmentally sound their practice are.

4a) Since the majority of farms are large factory farms, I concede that this is probably good for animal welfare. **
However**:

5) Purchasing meat from farms known to produce their meat in an ethical way not only denies demand to large factory farms but helps improve the market share of ethical meat-growing, which seems as though it would be even better for animal welfare.

My general view is that people should probably as a rule eat less meat from better growers, and that will make for a bigger shift in growing practices than simply people dropping out of eating meat altogether.
Moreover, this practice would be much easier to ""evangelize"" than a vegetarian or vegan diet.
Face it, meat is tasty (and non-factory meat is often tastier than factory-farmed meat, at least in my own anecdotal experience)","The chances of the entire world adopting a vegan/vegetarian diet are slim to none
The food market, like all other markets, operates on general principles of supply and demand
Meat farmers can use techniques exhibiting a range of costs or benefits, both in terms of environmental impact and animal welfare.
A vegan or vegetarian diet denies demand, and thus potential revenue, to all meat-producing farms, regardless of how humane or environmentally sound their practice are.
I concede that this is probably good for animal welfare.
Purchasing meat from farms known to produce their meat in an ethical way not only denies demand to large factory farms
helps improve the market share of ethical meat-growing
which seems as though it would be even better for animal welfare.
My general view is that people should probably as a rule eat less meat from better growers
that will make for a bigger shift in growing practices than simply people dropping out of eating meat altogether."
"Once again, read the article closely.
It's written by an Australian (where most livestock is grass-fed), and explicitly notes that it only applies when livestock is fed on grass rather than grain.
The fact that the US uses a poor method of production is not an indictment of the meat industry as a whole.",The fact that the US uses a poor method of production is not an indictment of the meat industry as a whole.
∆ I hadn't considered the obvious fact that web sites can be accessed globally and not everyone has the type of network the US enjoys.,web sites can be accessed globally and not everyone has the type of network the US enjoys
"Are you suggesting that INCREASING the number of weapons would decrease the lethal use of those weapons?  
 It MIGHT help mitigate one instance of shootings, like today's in Paris , but  surely tempt or instigate more occurrences in its place as the weapons are that much easier to access and use?  
 If increasing gun ownership would benefit society, would there be a point where if X number of people owned and carried a gun, there would be no shootings at all?  
 How do the stats stack up in support of your view? 

 This seems like a very difficult thing to prove or disprove either way because of the lack of research , but  I'm loathed to suggest increasing gun ownership could be a possible solution , because... I dunno,they have a reputation for misuse?  
 Surely, LESS would be better?"," Are you suggesting that INCREASING the number of weapons would decrease the lethal use of those weapons? 
 It MIGHT help mitigate one instance of shootings, like today's in Paris 
 This seems like a very difficult thing to prove or disprove either way because of the lack of research 
 I'm loathed to suggest increasing gun ownership could be a possible solution 
 Surely, LESS would be better? "
"> But hasn't most of the world moved past the age of tyrannical rulers ? Genocide is something most of the world has moved past, and only a few extremist individuals try to advocate it.

People thought the exact same thing before WWI.
They thought they were too civilized for what would happen in the next 50 years.
And I challenge the assertion we have moved past it considering what's happening in the middle east.
Hell, Rwanda wasn't that long ago either.
And even beyond tyranny the west seems complicit in a global order that directly leads to many deaths of the worlds poor each day that they could have prevented.

> I do agree that today's moderates are potentially tomorrow's conservatives. However this isn't about being just a bit conservative. It's about people that advocate death and destruction - terrorism, genocide, ethnic cleansing and murder.

One person's terrorist is another person's freedom fighter.
One's person's genocide is another person's defense of their culture.
One person's murderer is a other's soldier.
Now, I don't think all these comparisons are true, but they certainly aren't hard to make.
And they certainly have been made throughout history.

 > Conservatives don't do this, it's extremists.

Exactly, my point there wasn't that conservatives are terrible, but that what is considered moderate and okay changes.
It isn't some objective fact about people.
J. S. Mill would have been considered an extreme feminist back when he wrote, but today he's very much in the center of mainline liberal thought.
The point is what people consider moderate and reasonable isn't set in stone, and to adopt a zero tolerance policy cuts too deeply and may cut in the wrong direction (either failing to get bad people or getting good people)","I challenge the assertion we have moved past it considering what's happening in the middle east
even beyond tyranny the west seems complicit in a global order that directly leads to many deaths of the worlds poor each day that they could have prevented
I don't think all these comparisons are true
they certainly aren't hard to make
And they certainly have been made throughout history.
my point there wasn't that conservatives are terrible, but that what is considered moderate and okay changes
It isn't some objective fact about people.
The point is what people consider moderate and reasonable isn't set in stone
to adopt a zero tolerance policy cuts too deeply and may cut in the wrong direction"
"Title is mostly to get attention, and I'm working from a specific set of assumptions.
My argument is as follows:

1) The chances of the entire world adopting a vegan/vegetarian diet are slim to none

1a) Therefore, there will always be a market for meat and other animal products

2) The food market, like all other markets, operates on general principles of supply and demand

3) Meat farmers can use techniques exhibiting a range of costs or benefits, both in terms of environmental impact and animal welfare.

4) A vegan or vegetarian diet denies demand, and thus potential revenue, to all meat-producing farms, regardless of how humane or environmentally sound their practice are.

4a) Since the majority of farms are large factory farms, I concede that this is probably good for animal welfare. **
However**:

5) Purchasing meat from farms known to produce their meat in an ethical way not only denies demand to large factory farms but helps improve the market share of ethical meat-growing, which seems as though it would be even better for animal welfare.

My general view is that people should probably as a rule eat less meat from better growers, and that will make for a bigger shift in growing practices than simply people dropping out of eating meat altogether.
Moreover, this practice would be much easier to ""evangelize"" than a vegetarian or vegan diet.
Face it, meat is tasty (and non-factory meat is often tastier than factory-farmed meat, at least in my own anecdotal experience)","The chances of the entire world adopting a vegan/vegetarian diet are slim to none
The food market, like all other markets, operates on general principles of supply and demand
Meat farmers can use techniques exhibiting a range of costs or benefits, both in terms of environmental impact and animal welfare.
A vegan or vegetarian diet denies demand, and thus potential revenue, to all meat-producing farms, regardless of how humane or environmentally sound their practice are.
I concede that this is probably good for animal welfare.
Purchasing meat from farms known to produce their meat in an ethical way not only denies demand to large factory farms
helps improve the market share of ethical meat-growing
which seems as though it would be even better for animal welfare.
My general view is that people should probably as a rule eat less meat from better growers
that will make for a bigger shift in growing practices than simply people dropping out of eating meat altogether."
"Imagine reading a book that, once finished, is immediately erased from your memory.
That is what life is like.
Reading the book is ULTIMATELY pointless.
Because it is erased from your memory.

Life is pointless in a similar manner.",Life is pointless in a similar manner
"Your surrounded by enough Christians you're still probably more likely to be killed by a Christian for religious reasons than a Muslim.  
It's an issue of rate, and at that point, I'd like to see stats. 
 I'm not going to take an emotional appeal when considering whether or not a religion has dangerous components. 

What particular aspects do you find toxic?", I'm not going to take an emotional appeal when considering whether or not a religion has dangerous components. 
"For those of you who don’t know, it’s common (at least in the US) for businesses, transit agencies, etc. to give small discounts to military veterans to thank them for their service.

It seems that medical responders (even hospital staff, actually) and other emergency services do more good for society than soldiers and that such discounts should be given to them.

As for the “They’re not risking their lives for our country.” argument, police officers do that too, and for citizens rather than the country and its interests.
Some might argue that soldiers do the US a disservice rather than help, but that’s [usually] the fault of their leaders and therefore not relevant to the debate.

I’m really hoping there’s a good reason behind the status quo, but we’ll see.
[It looks like there’s even less reason behind it than I initially thought, actually.]

[edits in brackets]

[[My view’s been changed.](http://www.reddit.com/r/changemyview
/comments/2rexe3/cmv_emts_sar_firefighters_police_etc_should/cnfj9cu?context=10000) In summary, I think that EMS people are just as deserving of these discounts (and that many more people contribute enough to be placed in the same category), but I now believe - for the same reason - that these discounts shouldn’t be offered at all.]","It seems that medical responders (even hospital staff, actually) and other emergency services do more good for society than soldiers
such discounts should be given to them
EMS people are just as deserving of these discounts (and that many more people contribute enough to be placed in the same category)
these discounts shouldn’t be offered at all"
"So recently I've seen a lot of posts condemning Islam as a violent religion or a sexist religion.
I point out that many Christians follow the bible which has numerous examples of sexism, but in application, there are numerous branches of Christianity that are no more sexist than secular groups.
For example, Congregationalists and Universaliists.

So, my belief is that while religion can inform the views of people, it is far more likely that religion will be used to justify actions that would have been executed any way. I think that most Jewish people don't want to stone adulterers and most Muslims don't want to stone non believers.","I point out that many Christians follow the bible which has numerous examples of sexism, but in application, there are numerous branches of Christianity that are no more sexist than secular groups.
my belief is that while religion can inform the views of people, it is far more likely that religion will be used to justify actions that would have been executed any way.
I think that most Jewish people don't want to stone adulterers and most Muslims don't want to stone non believers."
"The modern domestic chicken is a hybrid of a red and grey junglefowl.
The egg produced by cross-breading the two species resulted in the first chicken.
Therefore, you are correct in saying that the egg came first, but your explanation is incorrect.","you are correct in saying that the egg came first
your explanation is incorrect"
"I'm definitely intrigued by this, but not quite convinced enough to delta
. I might be able to go to ""The religion eventually adopted by the Roman empire had a very good chance of becoming globally dominant"", but I think that's still largely an accident of geography, and your post definitely didn't address my point A) about a hypothetical identical religion in a different location.

Do you have any thoughts on, if not geography, why the abrahamic religions have become so widespread while other religions have not?","I'm definitely intrigued by this, but not quite convinced enough to delta
I might be able to go to ""The religion eventually adopted by the Roman empire had a very good chance of becoming globally dominant""
I think that's still largely an accident of geography
your post definitely didn't address my point A) about a hypothetical identical religion in a different location"
"For the sake of this thread, we'll exclude children with medically diagnosed learning disabilities; IMO the knowledge and resource base for teaching said children is probably proportionate to the percentage they make up of the overall population.

With a healthy child, income, neighborhood, peers and teachers should be filtered through a responsible parent(s).
A child who struggles in earnest or intentionally slacks off is a direct reflection of parenting.
I am curious regarding potential for more public accountability held to parents who fail to direct their child.(maybe a monetary incentive derived from public tax coffers paid to parents of children who maintain a passing grade, to be withheld if child dips below.)

I think parents are virtually 100% responsible for producing scholastically successful children.
CMV.","IMO the knowledge and resource base for teaching said children is probably proportionate to the percentage they make up of the overall population
A child who struggles in earnest or intentionally slacks off is a direct reflection of parenting.
I am curious regarding potential for more public accountability held to parents who fail to direct their child.
I think parents are virtually 100% responsible for producing scholastically successful children"
"That is a possibility of have not considered actually.
Only recently (past 4 years) my family added money to the free parking, and though I always attempted to get the auction rule in I was always voted down.
Perhaps that is the reason why I have such a strong dislike of the game.
Alas, I have not actually played it in a while and I'll play it with these rules before confirming the delta, for these rules may not be enough to convince me that the game is designed well.
Though it is theoretically sound it may not hold up","Perhaps that is the reason why I have such a strong dislike of the game.
Though it is theoretically sound it may not hold up"
"It really depends on how you view animal welfare.
I think most vegetarians see killing and eating an animal as wrong regardless of how good the conditions it lives in are.",It really depends on how you view animal welfare.
"Why is it irrational to pursue something pleasurable that will not provide pleasure of an infinite duration?
That seems like an arbitrary condition to apply to the value of pursuing pleasurable things.",That seems like an arbitrary condition to apply to the value of pursuing pleasurable things.
"In the last few weeks we've had two huge events happen in the world, both of which were caused by matters relating to ""freedom of speech."" The first being the hacking of Sony over The Interview, and today the shooting at the offices of a satirical magazine in Paris.
I certainly value our free speech but to me there is a clear line between exercising your first amendment right (""President Obama sucks!"" etc) and doing things that are known to be offensive to other cultures (Satirical cartoons of prophets, assassinating leaders, etc).

Perhaps this is a bad analogy - but if you say something antagonizing to a bully and you get your ass kicked, you should have anticipated that outcome.","I certainly value our free speech
there is a clear line between exercising your first amendment right (
Perhaps this is a bad analogy"
"How does a chicken ""want"" anything?
It is completely incapable of developing a though like, ""Today would REALLY suck if that damn fox bites me again"".

Yes, intelligence matters.
If not, we wouldn't allow brain-dead people to be unplugged.
Self-awareness puts one in a separate category than an animal.
But, regardless, I'm not trying to convince you not to care about animals, but that a rational person could come to the decision that those without higher cognition or self-awareness aren't equal.","It is completely incapable of developing a though like, ""Today would REALLY suck if that damn fox bites me again"".
Yes, intelligence matters.
Self-awareness puts one in a separate category than an animal.
I'm not trying to convince you not to care about animals
a rational person could come to the decision that those without higher cognition or self-awareness aren't equal."
