text,claim
"Thinking about today's news: [BBC](http://www.bbc.com/news/live/world-europe-30710777), [Wikipedia](http://en.wikipedia.org/wiki/Charlie_Hebdo_shooting)

I think France is in a tough spot in how to react to this.
There would be even stronger calls for an anti-islam and anti-immigration policies.
These event reminds people that they cannot depend on protection by government.
I think it would be a shame to allow the many, who are afraid more then anything, to be swayed by xenophobic nationalists (which might have been the goal of the attack anyway).

I think this, regardless of whether the weapons used by the attackers were owned legally, makes a good case for promoting a culture of a reasonable gun ownership and carrying.
Say if 1 out of 5 people carried a gun with them, was well trained in its use and tested in his responsibility to prevent its misuse, and society upheld the value of these people as protectors, it would benefit the society more the the current state of legislature and culture of gun ownership in most of European countries.
I also think this would be much better then increase in police numbers and rights as policemen are a very homogeneous group trained to stick together and the danger of even deepening the ""not one of us"" (pack) mentality and escalation of ""police state"".
Change my view.

PS: I am not here to talk about USA and its gun problems.

EDIT: Awarded a delta to a comment which didn't refute this idea but led me to change my view that it would be best realized with paralyzing weapons rather then guns: http://www.reddit.com/r/changemyview/comments/2rnr30/cmv_i_think_the_paris_shooting_makes_a_good_case/cni3o83","I think France is in a tough spot in how to react to this.
I think it would be a shame to allow the many, who are afraid more then anything, to be swayed by xenophobic nationalists (which might have been the goal of the attack anyway).
I think this, regardless of whether the weapons used by the attackers were owned legally, makes a good case for promoting a culture of a reasonable gun ownership and carrying.
I also think this would be much better then increase in police numbers and rights"
"okay. I sort of agree with you.
Was just curious if there had been any research you knew of",I sort of agree with you.
"""Something in the ballpark of 45% of women who have abortions have more than one abortion.""Something in the ballpark of 45% of women who have abortions have more than one abortion.
These people would have been raised by their incompetent parents to drain down society, increase crime rates, suck up resources, and generally screw things up.""These people would have been raised by their incompetent parents to drain down society, increase crime rates, suck up resources, and generally screw things up.""
What are you talking about?
Do you really think abortions are only had by incompetent people who couldn't be good parents?
This appears to be a belief that has led you to conclude that America must be better off but you are really misinformed about the type of women who obtain abortions.","Do you really think abortions are only had by incompetent people who couldn't be good parents?
This appears to be a belief that has led you to conclude that America must be better off
you are really misinformed about the type of women who obtain abortions."
">I think it's fairly normal to be a speciesist. I want to make note that I'm not trying to argue from a point of naturalism in regards to what ought to be done, but that it shouldn't be that surprising when we encounter people that are that way.

Yes, speciesism is indeed the norm and I appreciate you taking the time to comment.
I asked this question so as to keep myself grounded in what other justifications my loved ones around me didn't have the same epiphany I did (as it may not necessary be the same reasons I had for not going vegan sooner).

>I mean hell, it's hard enough for many people to empathize with each other, and you're asking them to try to put themselves in the hooves of a cow? It's just beyond the scope for many people unless they seriously put the time in to think about it, and they've got their own lives to worry about.

A very good reminder, thank you.
Not everyone is as obsessed with philosophy, psychology and nature as I am, just as I don't concern myself with keeping extremely up to date on world politics and Amnesty International petitions.

I'd still class it as option 3 though :P","Yes, speciesism is indeed the norm
I appreciate you taking the time to comment
I asked this question so as to keep myself grounded in what other justifications my loved ones around me didn't have the same epiphany I did
A very good reminder, thank you
Not everyone is as obsessed with philosophy, psychology and nature as I am
I'd still class it as option 3 though"
"> The boss pays each of her workers £5 for each doll that the worker produces

Most people aren't paid on commission, so this isn't really a good example, but I think I get where you're going with it.

>if each worker is being paid less than the price of the things they produce

But the money doesn't just disappear.
For one thing, you're neglecting the janitor who is necessary to keep the factory functioning (and presumably gets paid) but doesn't ""produce"" anything.
You're also neglecting that when this system scales up you need to include the boss buying things.

Since whatever profit the boss makes goes back into the system as they spend money, there should be at all times enough money in the system to cover the value of what it produced.
This value may not be the price being charged for the thing, and that's where supply and demand are involved.

I'm not going to deny that sometimes (or a lot of the time) the boss just hoards their extra money and doesn't re-inject it, but that's more a failure of the system than the system itself.
The same goes for when something is priced above its market value, it won't sell and will be waste, but that's because the seller overpriced it, not because it was doomed to be waste as soon as it was made.

No ideal system is really going to be inefficient, its the real ones that have problems.

If you mean to say that real-life capitalism is inefficient, then no one is going to dispute you, but I will point out that it's the most efficient real system we have.","this isn't really a good example
I think I get where you're going with it.
But the money doesn't just disappear.
there should be at all times enough money in the system to cover the value of what it produced
that's where supply and demand are involved
that's more a failure of the system than the system itself
The same goes for when something is priced above its market value
No ideal system is really going to be inefficient
its the real ones that have problems.
no one is going to dispute you
it's the most efficient real system we have"
"Thinking about today's news: [BBC](http://www.bbc.com/news/live/world-europe-30710777), [Wikipedia](http://en.wikipedia.org/wiki/Charlie_Hebdo_shooting)

I think France is in a tough spot in how to react to this.
There would be even stronger calls for an anti-islam and anti-immigration policies.
These event reminds people that they cannot depend on protection by government.
I think it would be a shame to allow the many, who are afraid more then anything, to be swayed by xenophobic nationalists (which might have been the goal of the attack anyway).

I think this, regardless of whether the weapons used by the attackers were owned legally, makes a good case for promoting a culture of a reasonable gun ownership and carrying.
Say if 1 out of 5 people carried a gun with them, was well trained in its use and tested in his responsibility to prevent its misuse, and society upheld the value of these people as protectors, it would benefit the society more the the current state of legislature and culture of gun ownership in most of European countries.
I also think this would be much better then increase in police numbers and rights as policemen are a very homogeneous group trained to stick together and the danger of even deepening the ""not one of us"" (pack) mentality and escalation of ""police state"".
Change my view.

PS: I am not here to talk about USA and its gun problems.

EDIT: Awarded a delta to a comment which didn't refute this idea but led me to change my view that it would be best realized with paralyzing weapons rather then guns: http://www.reddit.com/r/changemyview/comments/2rnr30/cmv_i_think_the_paris_shooting_makes_a_good_case/cni3o83","I think France is in a tough spot in how to react to this.
I think it would be a shame to allow the many, who are afraid more then anything, to be swayed by xenophobic nationalists (which might have been the goal of the attack anyway).
I think this, regardless of whether the weapons used by the attackers were owned legally, makes a good case for promoting a culture of a reasonable gun ownership and carrying.
I also think this would be much better then increase in police numbers and rights"
"If that was a good basis for having a huge population, India would be a superpower.
Good point none-the-less, but I disagree
(should be noted that India has less internet users and that the availibilty of the internet may play a huge part in people with less wealth being able to be innovative, so with the internet taken into account, your answer could be true) [Source](http://en.wikipedia.org/wiki/List_of_countries_by_number_of_Internet_users)","If that was a good basis for having a huge population, India would be a superpower
Good point none-the-less, but I disagree
with the internet taken into account, your answer could be true)"
"Actually, most commentators think they didn't show up for a year or two.
Also, ""inn"" is arguably a poor translation.
It wasn't a hotel that didn't have room for them.
It was that extended family didn't have a guest room for Joseph's family (perhaps because of the scandalous nature of Mary's pregnancy?).
Them being stuck in a barn has nothing to do with Joseph being cheap and everything to do with his family having poor hospitality.","Actually, most commentators think they didn't show up for a year or two
""inn"" is arguably a poor translation
Them being stuck in a barn has nothing to do with Joseph being cheap and everything to do with his family having poor hospitality"
"The thing is though, what is considered a political fringe isn't really all that subjective.

Most reasonable people think groups like the KKK, the Golden Dawn, Nazis, Militant anarchist terrorists, ISIS, Al-Qaeda and any other neo-fascist group are dangerous.","The thing is though, what is considered a political fringe isn't really all that subjective."
"Id just like to point out that this has never remotely seemed the case from my perspective as a lesbian.
Beyond that, there are many people who want close relationships without romance, an obvious example would be asexual people.
They can have close relationships that rival that of marriage, but how would you even quantify that?
How can you even compare them?
What about the relationship of a brother and sister?

If you limit it to just heterosexual non-related men and women, then maybe you're right, but then again who is to say what form of relationship is the highest, two very close lifetime friends who are platonic or a married couple?

The bottom line is that people are different from you can relationships are hard to compare.
Maybe for you, every relationship with a woman is motivated by romance.
For someone other hetero guy it might not be.
Sexual attraction is not something that just shuts off so even if you're in a lifelong comitted closed relationship you'll still probably feel attraction for other people.
Thats just reality for most people, and its not necesarily harmful and its not really shallow.

There are very few absolutes when it comes to interpersonal relationships.","this has never remotely seemed the case from my perspective as a lesbian
there are many people who want close relationships without romance
maybe you're right
people are different from you
relationships are hard to compare
Sexual attraction is not something that just shuts off
Thats just reality for most people
its not necesarily harmful and its not really shallow.
There are very few absolutes when it comes to interpersonal relationships."
"Anyone *can* run for office.
You might not get very far, but you can run.
And you don't need millions of dollars, you need to be *able to raise* millions of dollars.
In itself, I don't see a problem with that.
Raising large amounts of money requires leadership, diplomacy, organization, charisma… all traits I like to see in my elected officials.
The corruption and lack of transparency created by PACs and SuperPACs and Citizens United in general is definitely a major problem, but like some other things that have come up in this discussion, it's not an issue that makes the USA an un-democratic state.
There's no rule saying that the person who raises the most money wins the election.
The fact that most people vote for the most visible candidate on their side rather than the one that most closely represents their interests is a problem with the electorate and also a result of our winner-take-all voting system, but neither of those are in conflict with the USA being a democracy by definition.","Anyone *can* run for office.
you don't need millions of dollars
I don't see a problem with that
it's not an issue that makes the USA an un-democratic state
neither of those are in conflict with the USA being a democracy by definition"
"No they should not.
Those people are civilians with full civil rights and in the case of police, are in a privileged position with regard to the law.
Military personnel make substantial sacrifices and frequently live in poor conditions.
While I disagree with the hero fetish that is popular these days, I understand and support discounts for military personnel.
Also, note that EMS personnel are frequently employes of private corporations.","No they should not.
While I disagree with the hero fetish that is popular these days
I understand and support discounts for military personnel."
"> I don't think I'm misinterpreting the motivations of vegans.

Your OP implied that you thought the purpose of veganism is was to improve animal welfare.
Forgive me if I misinterpreted you.

> that people go vegan/vegetarian for a huge variety of reasons, from personal health to carbon footprint to animal welfare to ethics of eating meat to budget (meat is expensive).

Yes, these are all other reasons that people go into veganism.
However, since (I thought) your post pertained to the ""Vegans are vegans because they hate the state of animal welfare,"" reasoning, I made my post primarily about the relationship between vegans and animal welfare.",Your OP implied that you thought the purpose of veganism is was to improve animal welfare.
"I had parents who were extremely persistent about making sure i stayed on track.
I was only recently diagnosed with adhd a reading disability and im 20 years old.
I graduated on time but i struggled so much.
I failed a bunch of stuff and was constantly embarrassed to show my grades to other people.
I lost hope often because things felt hopeless, which lead teachers, doctors, family and other students to think i just didnt care.

An issue is there are a ton of people with ""disabilities"" more so than you'd think.
Thats because we teach everyone to think the same way.

Thats the issue.
Im really good at doing certain things.
For example, i can read , write, and even speak backwards pretty well.
My brain is wired differently.

I cant do the things the average person can, but i can do a lot of things that they cant.
It doesnt make me stupid, because im capable of the same things just in a different way, but my experience at school did its best to convince me that i was stupid.
THAT is the issue.
Everyone has a mind that works in its own way.

The problem isnt always bad parenting, though that can play a role, the problem is a black and white educational system.

Treating everyone the same way, other than special classes for ""dumb"" kids is the problem.

Learning seems hard or dumb to some kids and thats because its not tapping into their mind right.

If a child can discuss something he or she cares about then the parents are just a plus.","An issue is there are a ton of people with ""disabilities"" more so than you'd think.
Thats the issue.
It doesnt make me stupid
THAT is the issue
Everyone has a mind that works in its own way
The problem isnt always bad parenting, though that can play a role,
the problem is a black and white educational system
Treating everyone the same way, other than special classes for ""dumb"" kids is the problem.
Learning seems hard or dumb to some kids
If a child can discuss something he or she cares about then the parents are just a plus."
"That may be what YOU consider, but that's not what others consider, which is why they can validly reach different conclusions.

And ""suffer"" needs more definition to discuss whether it's something animals can do.","That may be what YOU consider, but that's not what others consider
they can validly reach different conclusions.
And ""suffer"" needs more definition to discuss whether it's something animals can do."
"partly, but communism in combination with capitalism has a different approach then pure communism, one of the failures of communism was the lack of incentive, with a part capitalism those with drive can still succeed, but everyone else will still have basic living tools,
and i won't lie, people will see a reduction in what they are able to buy, but when you balance that out with perpetual unemployment its still better then the alternative.
ps
Communism has some flaws, but it has also had a long time for people to find solutions to those flaws,","partly,
communism in combination with capitalism has a different approach then pure communism,
when you balance that out with perpetual unemployment its still better then the alternative.
Communism has some flaws,
it has also had a long time for people to find solutions to those flaws,"
"Simply speaking, one person can set in motion drastic change for an entire nation.
55 million chances to do so isn't a bad place to start.","Simply speaking, one person can set in motion drastic change for an entire nation"
"> Most reasonable people think groups like the KKK, the Golden Dawn, Nazis, Militant anarchist terrorists, ISIS, Al-Qaeda and any other neo-fascist group are dangerous.

I don't disagree, but on principle who gets to define what being a reasonable person is?
Stalin thought non-stalinists were dangerous, and probably a lot of Russians did too who most would consider reasonable.
Remember reasonable people actually voted Hitler into office.",I don't disagree
"They were there, but it seems to me as evidence that just having police is not enough.",it seems to me as evidence that just having police is not enough
"I personally am against the openness that society has taken with the internet
. I do not participate in most social media besides reddit, and even then I mostly lurk.
Regardless, I think that this openness is not detrimental per se, but is just a display of someone's character.
Like I said, I have no*problem* with anyone posting nudes, I just immediately view them differently as one seeking attention.
There are plenty of other ways to garner positive attention that everyone can agree is positive, instead of morally questionable behavior.
Of course no harm is done, but often this type of behavior CAN come back to haunt the original poster in a number of ways.

Also, why is gaining a celebrity status for something like posting nudes empowering?
What about that makes someone feel good?
When I see that type of situation I see someone who knowingly is attractive, considering they have a high status, and is willing to sexually pleasure their followers via this attractiveness that they already know they have.

I understand that a lot of the issues I raise are personal opinions not shared by others which is why I asked in the first place.
I as a person have a hard time seeing through other people's eyes if I can't justify a logical reason to do it.
I just don't see any reason in this type of behavior.
Also, I think that some of my problem is, like you said, the fine line I have drawn.
The lines I tend to draw in life are ambiguous and hard to support which often results in a weak basis for my opinions.
Hence, my seeking of others opinions.
Thanks for your reply.","I personally am against the openness that society has taken with the internet
.
I think that this openness is not detrimental per se, but is just a display of someone's character.
Like I said, I have no*problem* with anyone posting nudes,
I just immediately view them differently as one seeking attention.
When I see that type of situation I see someone who knowingly is attractive, considering they have a high status, and is willing to sexually pleasure their followers via this attractiveness that they already know they have.
I as a person have a hard time seeing through other people's eyes if I can't justify a logical reason to do it.
I just don't see any reason in this type of behavior."
"I personally don't see any distinction between my pet dog and a chicken.
If I had to take my cat to be euthanised at the vet, I would never consider his throat being sliced by a machine as he hung upside down as humane treatment.
Probably not even a bolt to the brain either.

I agree that synthetic meat would be absolutely amazing though!","I personally don't see any distinction between my pet dog and a chicken.
I would never consider his throat being sliced by a machine as he hung upside down as humane treatment.
Probably not even a bolt to the brain either.
I agree that synthetic meat would be absolutely amazing though!"
"Well in my brain a fair election is when anyone can run for office.
The fact that you need millions of dollars to do so seems unfair.
It instantly results in a situation where only the rich can run for and hold offices.
On the municipal level I don't think superpacs are a problem, but definitely on a federal level.","Well in my brain a fair election is when anyone can run for office.
On the municipal level I don't think superpacs are a problem, but definitely on a federal level."
"Title is mostly to get attention, and I'm working from a specific set of assumptions.
My argument is as follows:

1) The chances of the entire world adopting a vegan/vegetarian diet are slim to none

1a) Therefore, there will always be a market for meat and other animal products

2) The food market, like all other markets, operates on general principles of supply and demand

3) Meat farmers can use techniques exhibiting a range of costs or benefits, both in terms of environmental impact and animal welfare.

4) A vegan or vegetarian diet denies demand, and thus potential revenue, to all meat-producing farms, regardless of how humane or environmentally sound their practice are.

4a) Since the majority of farms are large factory farms, I concede that this is probably good for animal welfare. **
However**:

5) Purchasing meat from farms known to produce their meat in an ethical way not only denies demand to large factory farms but helps improve the market share of ethical meat-growing, which seems as though it would be even better for animal welfare.

My general view is that people should probably as a rule eat less meat from better growers, and that will make for a bigger shift in growing practices than simply people dropping out of eating meat altogether.
Moreover, this practice would be much easier to ""evangelize"" than a vegetarian or vegan diet.
Face it, meat is tasty (and non-factory meat is often tastier than factory-farmed meat, at least in my own anecdotal experience)","The chances of the entire world adopting a vegan/vegetarian diet are slim to none
The food market, like all other markets, operates on general principles of supply and demand
Meat farmers can use techniques exhibiting a range of costs or benefits, both in terms of environmental impact and animal welfare.
A vegan or vegetarian diet denies demand, and thus potential revenue, to all meat-producing farms, regardless of how humane or environmentally sound their practice are.
I concede that this is probably good for animal welfare.
Purchasing meat from farms known to produce their meat in an ethical way not only denies demand to large factory farms
helps improve the market share of ethical meat-growing
which seems as though it would be even better for animal welfare.
My general view is that people should probably as a rule eat less meat from better growers
that will make for a bigger shift in growing practices than simply people dropping out of eating meat altogether."
