text,claim
"That may be true.
My thinking was that abortions were mainly required by unfortunate people, who in turn from their difficult circumstances, would've raised the child to be the same.
Can you counter that? I have a [source](http://www.guttmacher.org/media/nr/2010/05/04/index.html) that shows that abortions are typically (and in some years, mostly) had by people without enough wealth to care for there kids.","That may be true.
My thinking was that abortions were mainly required by unfortunate people, who in turn from their difficult circumstances, would've raised the child to be the same."
"I’m not sure how sacrificing rights makes them more deserving of such discounts.
After all, rewarding people for suffering rather than production is what the commies do[!]",I’m not sure how sacrificing rights makes them more deserving of such discounts.
"It wouldn't be a fine, since it would only be a suspension of ""assistance"" anyway.
And poverty is a formidable obstacle but many, many people come from poverty to be wildly successful.
That cannot be a blanket excuse for poor academic performance.
I believe the fulcrum of a child's development has always been, and will always be the parent(a living, mentally capable set of or just one parent).","It wouldn't be a fine
That cannot be a blanket excuse for poor academic performance.
I believe the fulcrum of a child's development has always been, and will always be the parent(a living, mentally capable set of or just one parent)."
"So recently I've seen a lot of posts condemning Islam as a violent religion or a sexist religion.
I point out that many Christians follow the bible which has numerous examples of sexism, but in application, there are numerous branches of Christianity that are no more sexist than secular groups.
For example, Congregationalists and Universaliists.

So, my belief is that while religion can inform the views of people, it is far more likely that religion will be used to justify actions that would have been executed any way. I think that most Jewish people don't want to stone adulterers and most Muslims don't want to stone non believers.","I point out that many Christians follow the bible which has numerous examples of sexism, but in application, there are numerous branches of Christianity that are no more sexist than secular groups.
my belief is that while religion can inform the views of people, it is far more likely that religion will be used to justify actions that would have been executed any way.
I think that most Jewish people don't want to stone adulterers and most Muslims don't want to stone non believers."
"Yes, but I don't see how you intend to CMV with the scenarios 2 and 3.
I don't see them as very likely as nobody is going to draw a concealed gun when not intending to kill.

With scenario 1 I would expect the effect would be that the still thinking criminals would change to some other safer crime as their chances of getting shot would also increase.
It would still be illegal to kill a robber so I don't think some of them would start killing (thus being legal to kill in defense).","Yes
I don't see how you intend to CMV with the scenarios 2 and 3
I would expect the effect would be that the still thinking criminals would change to some other safer crime
I don't think some of them would start killing"
"Sure firefighters, EMT's, and nurses do great things for people. . . for those who have money and great insurance.
What a douchebag line.","Sure firefighters, EMT's, and nurses do great things for people. . . for those who have money and great insurance.
What a douchebag line."
"The DSM-IV defines delusion as:
A false belief based on incorrect inference about external reality that is firmly sustained despite what almost everyone else believes and despite what constitutes incontrovertible and obvious proof or evidence to the contrary.

Otherkin, or animalkin, the belief that their soul is an animal or something nonhuman, fit this definition and should be urged to seek psychiatric evaluation rather than joining communities of similar ""kin.""

If someone walks around genuinely convinced they are Jesus, the person is delusional and others would want to see that person medicated or receiving some form of psychiatric treatment for that persons own benefit.
But out of fear of offending and looking like an insensitive bigot, no one would respond to an otherkin in the same way they would someone claiming ultimate divinity.

We should not encourage and accept otherkin behavior, but rather encourage seeking treatment for a delusional disorder. CMV.","Otherkin, or animalkin, the belief that their soul is an animal or something nonhuman, fit this definition
should be urged to seek psychiatric evaluation rather than joining communities of similar ""kin.""
We should not encourage and accept otherkin behavior, but rather encourage seeking treatment for a delusional disorder."
"I confused patriotism, which is the love of one's country, with nationalism, which is the idea that one's country is better than other countries.
What you said is definitely true about patriots, but I misused patriots to mean nationalist.","I confused patriotism, which is the love of one's country, with nationalism, which is the idea that one's country is better than other countries."
">1. You don't agree with what is going on and stop supporting it.

Stop supporting it how?
As in never buying meat again, even as you know that doing so will not have any impact on the meat industry whatsoever, and won't make even an ounce of difference in the lives of animals?
What's the point?
If I stop eating meat today, it won't make any difference whatsoever and won't save even a single animal's life.

The only way to make real change in industries like this is to organize and participate in a boycott on a wide-scale level, and/or to petition the government to make regulation changes.","If I stop eating meat today, it won't make any difference whatsoever and won't save even a single animal's life.
The only way to make real change in industries like this is to organize and participate in a boycott on a wide-scale level
to petition the government to make regulation changes."
"Of course you intend to kill the person if you draw your weapon, if you can reasonably assume that they have a weapon, you can't wait for them to draw theirs before you decide to defend yourself if you want to leave alive.
All you know in all three scenarios is that someone you are in conflict with probably has a gun and there is a significant chance they will use it.

If you don't have reasonable cause to believe someone is armed because very few people have CCWs then things like letting the guy you just rear ended blow off steam becomes a reasonable option because he likely can't kill you within in a few seconds.

If 1 in 5 people can kill you in seconds being impolite gets deadly very quickly.","Of course you intend to kill the person if you draw your weapon, if you can reasonably assume that they have a weapon,
If you don't have reasonable cause to believe someone is armed because very few people have CCWs then things like letting the guy you just rear ended blow off steam becomes a reasonable option"
"∆
That makes a lot of sense!
Thank you! I can accept that it would be a wasteless system if there were multiple factories and the boss spent all of their money!
I can definitely think of other bits of inefficiency but that wasn't the question so nevermind! :)",it would be a wasteless system if there were multiple factories and the boss spent all of their money!
"I think this isn't ALWAYS true.
Some people aren't changed by others that easily.
And I think your argument applies only to boards like /b/ or /pol/.
If you go on 4chan right now to the /wg/ board (wallpapers) or the /vr/ board, almost everyone there is nice.
They are the boards to people with dedication and interests, though.","I think this isn't ALWAYS true.
I think your argument applies only to boards like /b/ or /pol/"
"You'd likely be dead in scenarios 2 and 3.
This isn't the movies where you duck bullets and dive behind a table or something.
By the time they have their hand on their gun you have maybe 2 seconds, and by the time they start aiming it at you, you have a fraction of one.
There is a reason why police, when they have reason to believe that someone is armed have their guns already drawn.
That shit happens fast, and reactive speed isn't fast enough.

As for scenario 1, once you remove the non-lethal option, the lethal one gets a lot more comfortable.","You'd likely be dead in scenarios 2 and 3.
once you remove the non-lethal option, the lethal one gets a lot more comfortable"
"Well, you have successfully moved me from ""it's probably about 80% geography"" to ""it's probably 40-60% geography"". I think that's enough for a ∆, so have one.
(edit: is that enough text for deltabot?
i can expand if necessary)","Well, you have successfully moved me from ""it's probably about 80% geography"" to ""it's probably 40-60% geography""
I think that's enough for a ∆, so have one"
"When I receive a compliment I should publicly recognize that then, right?
No only am I accepting their compliment, I'm showing some of what I truly believe.

That counts as a ∆!","When I receive a compliment I should publicly recognize that then, right?"
"I was at a christmas eve service last night (I'm Unitarian Universalist) and one of the hymns the choir did there, describing the birth of Jesus had it occurred in a Huron (Native American) community got me to thinking:

A) Had a group of religions identical in all respects to Judaism, Christianity, and Islam developed in pretty much any area other than the middle east, they would be no more successful than any of the other relatively minor faiths out there today, depending on what the location in question actually was

B) Whatever other religion had ended up developing in the middle east would likely now be globally dominant

I am not a trained historian, but it seems that the core of the success of the Abrahamic religions is dependent largely on the middle east's nature as both a major trade hub between Africa, Europe, and the rest of Asia, and on the fertile crescent's comparatively ancient status as a settled region.

Edit: I'd like to add that a large part of this view came from something a history teacher told me 6 years ago: ""Geography Determines Destiny"", and that quote has stuck with me.

Edit the second: though I won't say my view has been reversed or anything, it has definitely been broadened.
Thanks all!","it seems that the core of the success of the Abrahamic religions is dependent largely on the middle east's nature as both a major trade hub between Africa, Europe, and the rest of Asia
and on the fertile crescent's comparatively ancient status as a settled region"
"Firstly, I mentioned that.
(""for want of better measure of intelligence"")
I would love a better measure of intelligence.
[Some theorize that intelligence can be defined in categories, too...(http://en.wikipedia.org/wiki/Theory_of_multiple_intelligences) 
So, maybe a complex way to combine them.
Like a total of all of them.
Idc.

I know about number two...
I'm not proposing we implement it.
In a perfect world, sure.
But at least my theory limits the offspring of less-intelligent people.
Less intelligent- less babies than contributors- less ""less intelligent people"" (and that would always be the case...)

I completely understand your distaste with the IQ test.
Again, I only used the IQ test in my example because so far it is (seemingly) the most available measure of intelligence.
(better than SAT scores, right?)

And when the IQ test is adjusted, we would adjust the cutoff rate for ""da murder"" if we were to take that route in the first place.
(instead of killing lower than 80, it would be killing lower than like 50 or whatever)
The ""number of mental retardation"" would be adjusted from lower than 70 to whatever it would be, too, so I don't see your point there.
In total, everyone's IQ would be x points higher and so the human race would be x much smarter...
My route would be a slower, more ethical way to do it.","I mentioned that
I'm not proposing we implement it
I completely understand your distaste with the IQ test.
And when the IQ test is adjusted, we would adjust the cutoff rate for ""da murder"" if we were to take that route in the first place.
I don't see your point there
My route would be a slower, more ethical way to do it."
"Thinking about today's news: [BBC](http://www.bbc.com/news/live/world-europe-30710777), [Wikipedia](http://en.wikipedia.org/wiki/Charlie_Hebdo_shooting)

I think France is in a tough spot in how to react to this.
There would be even stronger calls for an anti-islam and anti-immigration policies.
These event reminds people that they cannot depend on protection by government.
I think it would be a shame to allow the many, who are afraid more then anything, to be swayed by xenophobic nationalists (which might have been the goal of the attack anyway).

I think this, regardless of whether the weapons used by the attackers were owned legally, makes a good case for promoting a culture of a reasonable gun ownership and carrying.
Say if 1 out of 5 people carried a gun with them, was well trained in its use and tested in his responsibility to prevent its misuse, and society upheld the value of these people as protectors, it would benefit the society more the the current state of legislature and culture of gun ownership in most of European countries.
I also think this would be much better then increase in police numbers and rights as policemen are a very homogeneous group trained to stick together and the danger of even deepening the ""not one of us"" (pack) mentality and escalation of ""police state"".
Change my view.

PS: I am not here to talk about USA and its gun problems.

EDIT: Awarded a delta to a comment which didn't refute this idea but led me to change my view that it would be best realized with paralyzing weapons rather then guns: http://www.reddit.com/r/changemyview/comments/2rnr30/cmv_i_think_the_paris_shooting_makes_a_good_case/cni3o83","I think France is in a tough spot in how to react to this.
I think it would be a shame to allow the many, who are afraid more then anything, to be swayed by xenophobic nationalists (which might have been the goal of the attack anyway).
I think this, regardless of whether the weapons used by the attackers were owned legally, makes a good case for promoting a culture of a reasonable gun ownership and carrying.
I also think this would be much better then increase in police numbers and rights"
"> Okay, I think you have officially Changed My View haha

Glad this has been a productive discussion.
If your view has indeed been changed, please draw your attention to ""The delta (∆) system"" in the sidebar and award me one delta.

The reason I think this is important is because I'm pissed off about the way things are in America, as I'm sure you are, and I always think that the best way to address a problem is to see it for what it is.
America's problem isn't that it isn't a democracy; rather, I think that America's problem is that it has fetishized democracy to the point where anything resulting from that system is accepted, even if it's corrupt and tyrannical, and that's exactly what it's turning into.
No, we're probably never going to get money out of politics entirely, but corporations being able to anonymously fund entire campaigns is a major threat to healthy government, even if it isn't, strictly speaking, un-democratic.","The reason I think this is important is because I'm pissed off about the way things are in America
I always think that the best way to address a problem is to see it for what it is
America's problem isn't that it isn't a democracy
I think that America's problem is that it has fetishized democracy to the point where anything resulting from that system is accepted, even if it's corrupt and tyrannical
that's exactly what it's turning into"
"sure, but as i've mentioned several times, that's not the point of this particular CMV post.
The point is that responsible carnivory is better for general livestock welfare than veg*","sure, but as i've mentioned several times, that's not the point of this particular CMV post.
The point is that responsible carnivory is better for general livestock welfare than veg*"
"> Your surrounded by enough Christians you're still probably more likely to be killed by a Christian for religious reasons than a Muslim

That is due to statistics, not to scripture or religious property.
you are more likely to be killed by a heart attack than by a christian, this doesn't say anything about christianity.

> I'm not going to take an emotional appeal when considering whether or not a religion has dangerous components.

Emotional?
I am just looking at the outcome of people following the religion.
Facts.

> What particular aspects do you find toxic?

The fanatism and radical actions it allows and encourages.
Do you want quran quotes or something?","this doesn't say anything about christianity
I am just looking at the outcome of people following the religion."
"That’s a good point, though I’m curious as to why they don’t advertise the other discounts.",That’s a good point
"I guess that this comes from my utilitarian-in-most-cases ethics.
I believe that small-medium improvements over large scales, such as an entire market, are better than large improvements at tiny scales.

Moreover, this CMV is not about ""veganism and vegetarianism are bad"" it's about ""eating meat responsibly is better for animal welfare than abstaining from eating meat""","I guess that this comes from my utilitarian-in-most-cases ethics.
I believe that small-medium improvements over large scales, such as an entire market, are better than large improvements at tiny scales.
this CMV is not about ""veganism and vegetarianism are bad""
it's about ""eating meat responsibly is better for animal welfare than abstaining from eating meat"""
"I definitely do condone any sort of reactionary violence and hope I didn't imply that through my post.
What would the reaction from Americans be if someone walked through the streets of a predominantly black neighborhood saying ""I hate black people"" and was murdered?
I guarantee no one would care.
But suddenly everyone was up in arms when they thought they were never going to see the movie The Interview because for a few moments Sony reevaluated the situation and decided not to release it.
Nobody seemed to be saying ""Jeez guys, maybe this is a really bad idea and we shouldn't do it."" Most people seemed to be saying ""Fuck North Korea!!
We'll watch our fucking movie cause we'ere FREE in America!!""","I definitely do condone any sort of reactionary violence
hope I didn't imply that through my post"
"Hmm maybe if it makes it easier for you.
Although I can imagine someone that has empathy for humans but none for other animals.","Hmm maybe if it makes it easier for you
I can imagine someone that has empathy for humans but none for other animals."
"> Meat is the industry that creates the most suffering for animals though... Being the one that requires the most land usage and causes the most environmental issues as well as obviously slaughtering them.

This doesn't really matter if it is something that is necessary.

> Vegans are also the group least likely to die of heart disease, with vegetarians being second and omnivores being first (or the same, depending on which study you're looking at). I'm convinced it's a healthier diet, which is a nice bonus for being compassionate.

[This study](http://www.ncbi.nlm.nih.gov/pubmed/20479151) shows that unprocessed meat is not linked to heart disease, but processed meat is.
I would also argue that a vegan *has* to be more conscious about their diet, and that extra attention results in health benefits.

Many people consider fish to be extremely healthy, and often include it in their ""vegetarian"" diets.
Eating fish has been associated with a *reduced* risk of heart disease.
Fish farms are equally as cruel as the rest of the meat industry, but we don't relate to them as much so they don't tug on our morals.

Certainly, you can still be healthy with alternative diets.
However, you have to curate your diet much more if you do not include meat. I'm not convinced that an equally curated diet including meat would not be healthier.","This doesn't really matter if it is something that is necessary.
extra attention results in health benefits
we don't relate to them as much so they don't tug on our morals
Certainly, you can still be healthy with alternative diets.
you have to curate your diet much more if you do not include meat.
I'm not convinced that an equally curated diet including meat would not be healthier."
"In the last few weeks we've had two huge events happen in the world, both of which were caused by matters relating to ""freedom of speech."" The first being the hacking of Sony over The Interview, and today the shooting at the offices of a satirical magazine in Paris.
I certainly value our free speech but to me there is a clear line between exercising your first amendment right (""President Obama sucks!"" etc) and doing things that are known to be offensive to other cultures (Satirical cartoons of prophets, assassinating leaders, etc).

Perhaps this is a bad analogy - but if you say something antagonizing to a bully and you get your ass kicked, you should have anticipated that outcome.","I certainly value our free speech
there is a clear line between exercising your first amendment right (
Perhaps this is a bad analogy"
"My fear is that pursuing those things is irrational, that since death is coming and will erase all experience regardless, I might as well go ahead and die.

Especially if there is more pain or dull moments than pleasure in life, why not just die?",I might as well go ahead and die
"Maybe it has to do with being an adolescent and being new to dealing with the opposite sex, but I'm beginning to fall under the assumption that the only purpose for guys to get to know girls is to eventually engage in romance.

""Why else do men engage women in conversation in public?"" I wonder (my perception might just be distorted after reading Neil Strauss's *The Game*).
""Why do I feel like chasing after girls and getting to know them when I have so many great guy friends already who I know care about me so much more? Why can't I be friends with girls (even pretty ones) and not feel insecure when I don't try to advance some romantic agenda?
Why do I find myself inevitably becoming attracted to them?""

I have so many more questions regarding the non-romantic side of male-female relationships, but instead of writing an abhorrent block of text nobody could possibly be expected to read, I ask just the one title question (thinking that the above questions are more like fragments of a bigger picture of misunderstanding) because I want to know what older, more mature people think.
It also must distort my view to have gone to an all-boy's school for the majority of my life.

At times, I feel like the interplay between men and women is always (at least always initially) a bs game where the man tries to show the woman how non-threatening and valuable he is from a non-romantic standpoint before she is comfortable with allowing herself to think of him as a safe partner.
Something about that seems so sinister, cynical, and hollow to me that I can't stand it.
Please change this view.","Maybe it has to do with being an adolescent and being new to dealing with the opposite sex
I'm beginning to fall under the assumption that the only purpose for guys to get to know girls is to eventually engage in romance.
my perception might just be distorted after reading Neil Strauss's *The Game*
I have so many more questions regarding the non-romantic side of male-female relationships
instead of writing an abhorrent block of text nobody could possibly be expected to read, I ask just the one title question
the above questions are more like fragments of a bigger picture of misunderstanding
It also must distort my view to have gone to an all-boy's school for the majority of my life.
I feel like the interplay between men and women is always (at least always initially) a bs game
I can't stand it"
"I want to point out that I absolutely **could not** stand to read the LotR trilogy.
And I tried.
I loved The Hobbit, even though it got slow, but I found Tolkien's prose to be far too slow-paced and filled with inane babbling about things too far removed from the plot.

I loved the extended edition because I get more engaged in an audio-visual medium than I do into books, as a general rule (this gets suspended for pretty much anything that starts with ""Harry Potter and the..."" but that's an exception), and the extended trilogy let me really grasp the world of Middle Earth for the first time.

And I'm the sort of person who, despite not really liking to read, will read summaries about the world surrounding my favorite movies or video games, because these are things I *want to know* but typically aren't in the film/game, so I endure the chore.
I *love* that the extended edition helped with this, especially in this situation, because most of the answers to that on the internet before were ""If you want to know more you should just read the damn books, scrub!"" because nerds are like that sometimes.","I want to point out that I absolutely **could not** stand to read the LotR trilogy.
I loved the extended edition
I *love* that the extended edition helped with this, especially in this situation,"
