text,claim
"The options are as follows:

1. You don't agree with what is going on and stop supporting it.

2. You don't care about animals, so you're content with paying for them to be abused for your pleasure.

3. You don't agree with what is going on, but try to put it to the back of your mind and continue to support it.

Reasoning: I used to follow 'option number 3', but recently started 'option number 1' in an attempt to line my actions up with my values.
I suspect this way of looking at it is still somewhat simplistic however, so feel free to prove me wrong.","The options are as follows
1. You don't agree with what is going on and stop supporting it.
2. You don't care about animals, so you're content with paying for them to be abused for your pleasure.
3. You don't agree with what is going on, but try to put it to the back of your mind and continue to support it.
I suspect this way of looking at it is still somewhat simplistic however"
"I guess we will always need first-hand experience when odd situations come up. 
I'll give you a delta in a bit when I'm on not on mobile.

EDIT: Here it is: &#8710; Merry Christmas",I guess we will always need first-hand experience when odd situations come up
"2nd reply: I will grant that changing the US laws would not change international laws, and the systems of treaties necessary to interface with other countries' economies would be complex in proportion to the complexities of those countries' economic law.
So, you get a delta for that point.
∆ I do think that the actual practice of economics would become drastically simpler if the law were simpler internationally (in ways that I respect would still be complicated) but I agree with the point you didn't necessarily actually make that reforming all the countries' economic legal systems to be simpler in compatible ways at the same time is a way bigger implausibility than reforming just one country's economic law in a way that is self-consistent.","changing the US laws would not change international laws
the systems of treaties necessary to interface with other countries' economies would be complex in proportion to the complexities of those countries' economic law
reforming all the countries' economic legal systems to be simpler in compatible ways at the same time is a way bigger implausibility than reforming just one country's economic law in a way that is self-consistent."
"∆ Interesting, I was not aware of this perspective, and certainly a lot can be lost in translation, especially multiple translations over centuries.","Interesting, I was not aware of this perspective
certainly a lot can be lost in translation, especially multiple translations over centuries"
"Scenario 1: I don't think this decision changes if you are comfortable killing for money you kill for money if you can get away with it.
Scenario 2: When he starts to pulling out a gun you try to get cover, when he starts aiming at you you draw to fire.
Scenario 3: The known rule would be only to draw gun to shoot and who is aiming at you is aiming at you to shoot so you are in right to defend yourself.
If you are unsure of someone's intentions you should get cover and as soon he notices that and doesn't intend to kill you he should make this well known to you as he doesn't you to shoot him either.","I don't think this decision changes if you are comfortable killing for money
When he starts to pulling out a gun you try to get cover
when he starts aiming at you you draw to fire
you are in right to defend yourself
If you are unsure of someone's intentions you should get cover
as soon he notices that and doesn't intend to kill you he should make this well known to you"
"I've always had a respect for the men in uniform and I've always wanted to join.
Recently I've disagreed with the practices of the U.S. military but that doesn't mean that I hate the Warriors, just the people that force them into it.
I'm an immigrant and a Muslim neither of which is or should be a deterrent from joining.
I want to be a doctor, not because of familial pressure but of a genuine need to help.
So here's where I am now: currently in first year of college studying biology, enough AP credits to be a tiny bit ahead of my classmates, an itching to explore this giant world God gave me, I'm also poor and medical school in the military (from what I understand) pays for smart kids.
Also, please forgive me if this is wrong or arrogant or whatever, I want the respect that people give men and women in the military.

My plan was to graduate College and join the USHS (the military medical school) and become and Army doctor.
The only reservation that I had was that it would be a waste of my time because I want to be a neurosurgeon and that's a looooooooong and rigorous path and that I might be losing precious time by joining the military.
My mom doesn't want me to join for that reason.
Other things that I've considered: I love the idea of a brotherhood but I don't agree with the ideology, the military putting me through Med school will help me jump start life, I'm very inexperienced and haven't seen much of the world and this I think will help me.

I look forward to having my views challenged!
Thanks!","I've always had a respect for the men in uniform and I've always wanted to join.
Recently I've disagreed with the practices of the U.S. military
The only reservation that I had was that it would be a waste of my time
I love the idea of a brotherhood but I don't agree with the ideology,
the military putting me through Med school will help me jump start life,
I'm very inexperienced and haven't seen much of the world and this I think will help me"
"Hmm... I understand your point.
And your explanation on why the series' games are extremely similar to each other is superb.
However, this in itself isn't why I think the games are overrated.
Many other game serie use a formulaic system for their games that renders them very similar to each other, such as Assassin's Creed, or Pokemon.
The thing about CoD that really makes it an overrated series is that it is very similar to other FPS games, such as Battlefield.
It really doesn't have any revolutionary groundbreaking features of its own, and each game feeds off the success of its predecessor.","And your explanation on why the series' games are extremely similar to each other is superb.
However, this in itself isn't why I think the games are overrated.
It really doesn't have any revolutionary groundbreaking features of its own,
each game feeds off the success of its predecessor."
"No I'm not claiming this.  
Please read again my original post, this time trying to understand it.
 Distinguish between decreasing and stopping, owning and responsibly owning, laws and culture...", No I'm not claiming this. 
Another strong pro-veg point is that meat production is really bad for environment.,Another strong pro-veg point is that meat production is really bad for environment.
"I certainly agree with your points - I didn't mean to imply that I was only for **some** freedom of speech. 
I just think lately there's been a lot of antagonistic material being published and everyone cries freedom of speech when certain groups get upset.

Why can't America be the bigger person and say ""Ok, we won't publish certain types of material, not because we're afraid of you but because we respect your views.""
Is that so hard?","I certainly agree with your points 
I didn't mean to imply that I was only for **some** freedom of speech
I just think lately there's been a lot of antagonistic material being published and everyone cries freedom of speech when certain groups get upset"
"Matthew 2:11

""And when they were come into the house, they saw the young child with Mary his mother, and fell down, and worshipped him and when they had opened their treasures, they presented unto him gifts; gold, and frankincense and myrrh.""

When the wise men visited Jesus, it was in a house.
The Nativity scene is about the visit of the shepherds, but the wise men are drawn into the manger scene early because it looks cooler that way.","The Nativity scene is about the visit of the shepherds
the wise men are drawn into the manger scene early"
"Then wouldn't a complement be just an acknowledgement of the time and effort you put into something that most people see as hard or worthwhile?
This implies the complement is meaningful.

(Most people don't do this - either they don't put the time and effort into something generally hard or worthwhile or the time and effort isn't hard or worthwhile.)","This implies the complement is meaningful.
Most people don't do this"
"Traditionally, in medieval Christian art, there is no consideration of time.
In other words, events that happen at different points in the narrative are depicted as occuring side-by-side without consideration for *when* and *where* they actually happened.
For instance, Jesus might be depicted as both a child and an adult in the same image.

One of the reasons the Italian Renaissance was, well, a *renaissance* was because its painters and artists began presenting things in a more realistic way, like how we might now think of as like a photograph: a specific moment frozen in time.

My point is, there is precedent for depicting stories from the Jesus narrative with no consideration for the actual timeline of events, merely throwing together elements because they are related thematically or tangentially.
You're interpretting this as if it is meant to show something ""as it happened"" when art doesn't always work that way.","there is precedent for depicting stories from the Jesus narrative with no consideration for the actual timeline of events
merely throwing together elements because they are related thematically or tangentially
You're interpretting this as if it is meant to show something ""as it happened"" when art doesn't always work that way"
"As someone from a developing country, I would like to point out that mobile sites require less amount of data transfer to view than a desktop site which is a big thing for us due to slower Internet connections.",mobile sites require less amount of data transfer to view than a desktop site
"Self awareness isn't a human-exclusive trait - dolphins, apes and elephants have been proven to possess it.
Regardless of self-awareness, the ability to suffer is what I regard as being more important to an individual.","Self awareness isn't a human-exclusive trait
the ability to suffer is what I regard as being more important to an individual."
"As other's said, who gets to decide what these bad ideologies are.
Here's a substitution using your syntax, but modified details.

 > Zero tolerance, whatever it takes.
Schools should educate children on the dangers of jewish zionism and their poison should be kept out of the minds of children.
Young impressionable minds are the easiest targets for zionist indoctrination.
In a highly connected online era, it has become far too easy to recruit people into the zionist movement.
When facebook and twitter is used to recruit zionist supporters and other jewish terrorists online en masse, there is a problem.
The German majority needs to grow a spine and say enough is enough.

Now, this is obviously extreme, but you see how such an extreme zero tolerance policy can be dangerous in its inflexibility and its arbitrariness.","Schools should educate children on the dangers of jewish zionism
their poison should be kept out of the minds of children
The German majority needs to grow a spine and say enough is enough.
this is obviously extreme
you see how such an extreme zero tolerance policy can be dangerous in its inflexibility and its arbitrariness"
"I wouldn't consider it pointless if I derived pleasure from reading it at the time.

I mean if you really believe that everything that does not last forever is pointless, why do you do anything? Why not sit in a corner and stare at a wall until you die?
I would guess that it's because you derive pleasure from certain things in life and that you pursue these things just like everyone else does.",I wouldn't consider it pointless if I derived pleasure from reading it at the time
"Because once you die, it is as if none of it ever happened.
None of it.

So to YOU, there is, then, no meaning.","So to YOU, there is, then, no meaning"
"If the various artists who contributed to the scene had intended to make Joseph stereotypically Jewish, they would have.
They'd have given him a big hooked nose.
They'd have given him opulent dress while giving Mary or Jesus poorer dress.
Something.

But no: they don't make Joseph look Jewish at all
. If there's anything anti-Semitic going on, it's the near-erasure of Jesus/Mary/Joseph's Jewishness.
The artists aren't focusing on Joseph as a Jew; he's an early Christian to them.

As to why this conflation of two similar events?
That's a pretty common artistic trope.
You say ""event X is like event Y, let's put them together"".
The visit of the shepherds and the visit of the kings are narratively redundant.
It's just cleaner storytelling to do the mashup.","If the various artists who contributed to the scene had intended to make Joseph stereotypically Jewish, they would have
But no: they don't make Joseph look Jewish at all
The artists aren't focusing on Joseph as a Jew
That's a pretty common artistic trope"
"Although it's highly unlikely that there would be a long period without conflict, I can see how something similar could happen.
However, it's not like the previous generation's knowledge would have disappeared there are thousands of guides and essays about every topic.","it's highly unlikely that there would be a long period without conflict
I can see how something similar could happen
it's not like the previous generation's knowledge would have disappeared"
"There is a 4th choice.
You can choose to not anthropomorphize animals, and, despite how much you love your dog, realize that a chicken is just a chicken, and that your farmed tilapia doesn't have the cognition to question whether it's life is worth living.

I want the animals to be raised humanely, and, yes, I want them to be killed humanely.
But it's not like a wild turkey sits on it's deathbed and thinks fondly of those days gone by, when it roamed free and raised its baby turkeys.
No, it thinks more ""food? sex? food?"".

Yes, they feel pain, but so does an earthworm, if you mean ""experience messages that say 'bad things are happening - endeavor to stop them'"".
They don't look back and say, ""Man, remember when I bumped into that electric fence?
That hurt like hell.""
The best they can manage is ""Fence. Bad.""

There is no ""meaningful"" or ""meaningless"" life for an animal - they don't philosophize beyond needs.
Most farm animals spend less time hungry, scratched by brambles, running from predators, etc than wild animals.
It doesn't make it a better of worse life - it's just existing.
That's the other choice - accepting that animals are less than humans.","There is a 4th choice.
despite how much you love your dog
your farmed tilapia doesn't have the cognition to question whether it's life is worth living.
I want the animals to be raised humanely
I want them to be killed humanely
No, it thinks more ""food? sex? food?"".
The best they can manage is ""Fence. Bad.""
It doesn't make it a better of worse life - it's just existing.
That's the other choice - accepting that animals are less than humans."
"> What would the reaction from Americans be if someone walked through the streets of a predominantly black neighborhood saying ""I hate black people"" and was murdered?

""What would the likely reaction be?"" is not the right question to ask. You should ask ""what is the proper reaction?"" A person doing that is probably an asshole, but that does not mean that silencing him is a proper reaction.
And I think many people would care, because nothing you say should be enough to justify my shooting you.

The two examples you've mentioned are both examples of satire that have been forcibly silenced.
Satire is the portion of speech that always stretches the boundaries of what we condone because its purpose is often to be offensive as a means of highlighting truths about people or society that are difficult to address seriously.

In any case, I think you may have missed the point.
None of the examples you given actually hurt anybody.
They have only provoked reactions.
North Korea hacked Sony because they are so paranoid and insecure that they can't stand their leader being mocked.
Some Muslims are so irrationally offended and self-important that they believe they have both the imperative and the right to kill people for drawing pictures.
Neither of these examples illustrate problems with the speakers, they show the unhinged reactions of listeners.","""What would the likely reaction be?"" is not the right question to ask.
You should ask ""what is the proper reaction?""
The two examples you've mentioned are both examples of satire that have been forcibly silenced.
I think you may have missed the point"
"A lot (dunno %) vegetarians/vegans see killing animals for food is fundamentally unethical.
So they are not doing it for better state of animal welfare in farms.
I personally don't have a problem with animals being killed humanely, so if I become vegetarian it would be about welfare.
But that's me.
But I agree with you that becoming vegetarian just for that is not very helpful for welfare.
I just see people's reasoning.","A lot (dunno %) vegetarians/vegans see killing animals for food is fundamentally unethical.
they are not doing it for better state of animal welfare in farms
I agree with you that becoming vegetarian just for that is not very helpful for welfare"
"I read it a month or so ago I'm actually referring to corn.
More corn is produced for livestock than humans.

36% of all privately held acres in the US is used for growing corn just for livestock.

That's without even getting into the massive amounts of land used for soy and hay production for livestock.",I read it a month or so ago I'm actually referring to corn.
"I'd like to start off by saying that the CoD games are good games in their own right, though they are extremely overhyped.
One reason I take this stance is because the newly released games are ectremely similar to their predecessors.
There are few if any changes in gameplay, and the basic level design for the most part, remains the same.
Even Advanced Warfare, which seemed to promise the most novel changes, was criticized for changing too little from its preceding games.

Another reason for my opinion is that CoD doesn't really have anything astoundingly different from other games of the same genre.
There are a few unique features here and there, but overall, it's just another FPS with nothing spectacular that sets it above the other games in its genre.","I'd like to start off by saying that the CoD games are good games in their own right,
they are extremely overhyped"
"Okay, but even if religion did motivate people to kill, it doesn't provide the means to kill, only the motivation.  
 However, assuming that a gun provides the motivation, it also provides the tool to kill someone with. 

That being said,  I'm not convinced that either motivates people to kill, and one gives the tools to kill with and the other doesn't . 
 This analogy falls short for me."," Okay, but even if religion did motivate people to kill, it doesn't provide the means to kill, only the motivation. 
 I'm not convinced that either motivates people to kill, and one gives the tools to kill with and the other doesn't 
 This analogy falls short for me. "
"Something like this will take decades or centuries and won't be applied evenly across the entire planet.
I don't see how it's possible society couldn't adapt as the inevitability of a laborless civilization grows.",Something like this will take decades or centuries and won't be applied evenly across the entire planet.
"In a day, I eat maybe 1/3 of a cow or 1/2 of a chicken if I'm hungry
If I were eating veggies, I'd consume several plants.
I consider my 1 chicken/2 days to be morally equivalent to the 8 heads of lettuce/day it would take me to get the same basic caloric intake (note: I don't have any real accuracy for the amount per day, just a rough guesstimation) to be about morally equal.

>The fact we have domesticated some animals also does not mean they suffer any differently to their wild cousins.

On the contrary: A sheep with a shepherd is many times less likely to have its throat ripped out by a wolf and having its last experience on earth be something as gruesome as the beginnings of being eaten.
A bolt to the brain sounds bad, but there is nothing past that instant.
No pain, no awareness, just cessation of life.
Ditto that for every other domestic food animal, and even animals that we hunt for food: at the very least we are less vicious than other predators in that we wait until the animal is definitely dead before we start eating it.

I'm not arguing that death at the hands of humans is better than living on; in the general sense, living on is better than just about any death; I'm arguing that of the potential ways to die, being killed is the best an animal can realistically hope for.","I consider my 1 chicken/2 days to be morally equivalent to the 8 heads of lettuce/day it would take me to get the same basic caloric intake (note: I don't have any real accuracy for the amount per day, just a rough guesstimation) to be about morally equal.
A sheep with a shepherd is many times less likely to have its throat ripped out by a wolf and having its last experience on earth be something as gruesome as the beginnings of being eaten.
there is nothing past that instant
at the very least we are less vicious than other predators in that we wait until the animal is definitely dead before we start eating it
I'm not arguing that death at the hands of humans is better than living on
living on is better than just about any death
I'm arguing that of the potential ways to die, being killed is the best an animal can realistically hope for"
"What if time itself is an illusion, and we really do live forever?

Consider a novel.
As you read through the novel, you go from page to page, eventually reaching the end.
But does the novel stop existing just because you finished the book?
Or does the book continue to exist, with it's words, chapters, stories, characters, and lives intact?

""Now"" is *the page you are reading at this moment*.
But just because there are pages you've already read, or pages you have yet to read, doesn't mean those pages don't exist.
And all those pages will continue to exist, even after you've finished your book.","just because there are pages you've already read, or pages you have yet to read, doesn't mean those pages don't exist"
"I am just expressing that I find current islam a religion I mistrust.
I am not saying everyone should mistrust them or that I should change my behaviour in any way, but islam has some toxic components christianity no longer has.

> far morel likely in general to be killed by a Christian than a Muslim

This has nothing to do with the religion but by what we are surrounded by.
I probably am more likely to be killed by a muslim than a christian *because of their religion*. Although the odds have little to do regarding trust or feelings.","I am just expressing that I find current islam a religion I mistrust.
I am not saying everyone should mistrust them or that I should change my behaviour in any way
This has nothing to do with the religion but by what we are surrounded by."
"Your first paragraph is intriguing, and I definitely agree with it.
The freedom fighter/terrorist comparison is also an interesting perspective.
Although I do think more needs to be done to combat extremism, I see where you're coming from on this.

∆","Your first paragraph is intriguing
I definitely agree with it
The freedom fighter/terrorist comparison is also an interesting perspective.
Although I do think more needs to be done to combat extremism, I see where you're coming from on this."
"∆

Edit: tried to award you the delta.

Native intelligence is the challenge.
I won't delve into how this has infected my view, but I will say that it ties into why I think a moneyless society would over time revert to fiat currency.
Some people can do some thing's better than others...thanks.
Nice exercise.

Edit: there we go!","Native intelligence is the challenge.
I will say that it ties into why I think a moneyless society would over time revert to fiat currency
Nice exercise"
"Firstly, IQ is not considered to be a good or accurate measure of overall intellect.
Intelligence is hard to define and describe even by neurologists and reducing that complexity down to one number is incredibly challenging if not impossible.

It may also be important to note that your system isn't only difficult to implement like you point out, it's also in direct conflict with how things actually work.
More intelligent people tend to have less children than do the more uneducated.
There are multiple reasons for this, more intelligent people tend to be more busy with careers, etc.

Lastly you must recognize that the IQ test is a standardized test.
This means that even if we went really extreme and killed everyone with an IQ under 80.....that would change nothing.
The average IQ will still be measured in the same way, the lowest scores will be assigned the lower numbers and the average will be the same.","IQ is not considered to be a good or accurate measure of overall intellect
It may also be important to note that your system isn't only difficult to implement like you point out, it's also in direct conflict with how things actually work.
Lastly you must recognize that the IQ test is a standardized test."
